en;it;es;fr
;\nb[???]Avete forza di volontà da vendere, stupidi esseri!;;
;\nb[???]Bene, allora preparatevi alla resa definitiva dei conti.\|§ Oltre non si va!;;
;\nb[\n[1]]Uh, bella trasformazione, mostriciattolo verde.;;
;\nb[DERIJIRO]Io sono Derijiro, un drago che milioni di anni fa, insieme ai miei simili, ha creato questo pianeta per voi.;;
;\nb[DERIJIRO]Un tempo popolavamo noi questo posto, ma poi...\| diventammo in molti e questo pianeta divenne§ troppo piccolo per rimanerci tutti quanti, tanti eravamo.;;
;\nb[DERIJIRO]Così ci trasferimmo su un altro mondo, lasciando questo a voi, inutili esseri, evoluti durante la nostra lunga assenza.;;
;\nb[DERIJIRO]Ma ora...\| IO RIVOGLIO QUESTO PIANETA!\|§ E vi caccerò via tutti quanti, cominciando da voi.;;
;\nb[DERIJIRO]Ormai le \map[Ancient Ruins] stanno risorgendo...\. Il nostro mondo rimasto seppelito e nascosto per secoli sta tornando come era un tempo, sterminando ogni vostra creazione!;;
;\nb[DERIJIRO]Il CRISTALLO DI TEORHEMAS, la nostra più potente invenzione, sta richiamando i nostri luoghi dal sottosuolo...\|§ Non avete più scampo!;;
;\nb[DERIJIRO]Ed ora...\| Avrò finalmente l'onore di eliminarvi con le mie stesse mani!;;
;\nb[DERIJIRO]MORITE, EROI!;;
;L'unico modo per arrecare danno a Derijiro è colpirlo con la spada creata da lui stesso: la \nw[25]!;;
;La \nw[25] può sfruttare l'energia di tutti e tre gli elementi (fuoco, ghiaccio, elettricità) per combinare attacchi devastanti!;;
;I Punti Abilità, equipaggiando la \nw[25], vengono rigenerati gradualmente in modo§ automatico.;;
;Quando la barra è piena, premi Q per sferrare il tuo attacco!;;
;\c[18]-ENERGIA RECUPERATA!§ -DIFESA INCREMENTATA!;;
;\c[18]-ENERGIA RECUPERATA!§ -ATTACCO INCREMENTATO!\c[0]§ Ora puoi danneggiare Derijiro!;;
;L'attacco non è stato abbastanza efficace!§ Devi prima indebolire Derijiro!;;
;Derijiro è indebolito, puoi usare l'abilità elettrica per infliggergli un colpo decisivo!;;
;Confermi?§ Sì§ No;;
