en;it;es;fr
;\nb[SAGGIO]Eccoti, eroe!\.§ Come ben sai, procedendo di qua accederai all'Arena!;;
;\nb[SAGGIO]L'Arena è molto utile per allenarsi in battaglia, ma anche per guadagnare qualche Dindino in più!;;
;\nb[SAGGIO]Infatti l'Arena si è rinnovata: oltre alla classica 'Battaglia in Arena', dove guadagni Dindini in base al numero di nemici sconfitti, potrai ora partecipare alla nuova sfida 'Il Lancio del Peso'!;;
;\nb[SAGGIO]In questa nuova sfida dovrai caricare la tua spada e, con un po' di fortuna, lanciare il peso il più lontano possibile, battendo il tuo rivale!;;
;\nb[SAGGIO]Da ora potrai accedere all'Arena quando vorrai!\|§ Io sarò ad aspettarti fuori dal Castello.\. Vieni da me non appena sarai pronto a proseguire con la tua avventura!;;
;Sei pronto per cominciare una nuova sfida in Arena?;;
;\lbl\c[14]SCEGLI LA MODALITÀ ARENA:\c[10]\lbl§ Battaglia in Arena§ Lancio del Peso§ \c[0]Esci;;
;Non vedo l'ora di partecipare alla prossima sfida!;;
